{
  "tranche_id": "MA-3A",
  "objective": "Repair MA-3 autonomy approval to resolve the PR head SHA from GitHub and require an independent current-head reviewer for high-risk pull requests.",
  "repository": "chriskulbaba2025/gacm-trial",
  "base_branch": "main",
  "start_sha": "abe07315f9cf804b356fe0d1b50af7269b9fdd3f",
  "model": "gpt-5.6-luna",
  "allowed_paths": [".github/workflows/gacm-autonomy.yml", "src/gacm/metrics/autonomy.py", "tests/test_autonomy_*.py", "tranches/MA-3A.json", "runs/MA-3A.json", "docs/GACM_AUTONOMY_LEVELS_V1.md"],
  "forbidden_paths": ["AGENTS.md", "CURRENT_STATE.md", "docs/governance/**", "docs/GACM_RED_QUEEN_TOKEN_EFFICIENCY_PROCESS_V1.md", "policy/**", "schemas/**", "src/gacm/gate/**", ".github/CODEOWNERS"],
  "required_checks": ["gacm-gate", "governance-regression", "gacm-autonomy"],
  "retry_limit": 3,
  "budget": "one Codex session at Chris-configured limits",
  "approver": "@chriskulbaba2025",
  "declared_risk_class": "high"
}
