{
  "tranche_id": "MA-1D",
  "objective": "Repair the gate workflow so it evaluates the committed tranche identity rather than MA-1A only.",
  "repository": "chriskulbaba2025/gacm-trial",
  "base_branch": "main",
  "start_sha": "e0734ce5f376af108121c4ee3d10547a6ee6e88c",
  "model": "gpt-5.6-terra",
  "allowed_paths": ["src/gacm/gate/**", "src/gacm/__main__.py", ".github/workflows/gacm-gate.yml", "tests/red_queen/**", "tranches/MA-1D.json", "docs/GACM_TRANCHE_GATE_V1.md"],
  "forbidden_paths": ["AGENTS.md", "CURRENT_STATE.md", "docs/governance/**", "docs/GACM_RED_QUEEN_TOKEN_EFFICIENCY_PROCESS_V1.md"],
  "required_checks": ["gacm-gate", "governance-regression"],
  "retry_limit": 3,
  "budget": "one Codex session at Chris-configured limits",
  "approver": "@chriskulbaba2025",
  "declared_risk_class": "high"
}
